<?xml version="1.0" encoding="UTF-8"?>
<xs:schema xmlns:xs="http://www.w3.org/2001/XMLSchema">
    <xs:element name="orders">
        <xs:complexType>
            <xs:sequence>
                <xs:element name="order" maxOccurs="unbounded">
                    <xs:complexType>
                        <xs:sequence>
                            <xs:element name="orders_id" type="xs:int"/>
                            <xs:element name="customer_id" type="xs:int"/>
                            <xs:element name="order_date" type="xs:date"/>
                            <xs:element name="order_status" type="xs:string"/>
                        </xs:sequence>
                    </xs:complexType>
                </xs:element>
            </xs:sequence>
        </xs:complexType>
    </xs:element>
</xs:schema>
